{
  "schema_version": 1,
  "id": "async-bounded-inflight",
  "title": "Async worker with bounded inflight",
  "category": "Execution Semantics",
  "summary": "Request validation followed by an async worker edge with max_inflight=2 and bounded queue capacity.",
  "difficulty": "intermediate",
  "graph": "async_bounded_inflight.yaml",
  "show_in_readme": true,
  "readme_priority": 40,
  "expected_exit": 0,
  "commands": [
    {
      "label": "Validate",
      "argv": [
        "graph",
        "validate",
        "examples/30-async/async_bounded_inflight.yaml"
      ],
      "expect_success": true
    },
    {
      "label": "Run",
      "argv": [
        "graph",
        "run",
        "examples/30-async/async_bounded_inflight.yaml",
        "--steps",
        "4"
      ],
      "expect_success": true
    },
    {
      "label": "Trace",
      "argv": [
        "graph",
        "trace",
        "examples/30-async/async_bounded_inflight.yaml",
        "--steps",
        "4",
        "--format",
        "json"
      ],
      "expect_success": true
    }
  ],
  "assets": {
    "generate_graph": true,
    "generate_metrics_summary": false,
    "generate_trace_summary": true
  },
  "ci": {
    "validate": true,
    "run": true,
    "render": true,
    "smoke": true
  },
  "related_docs": [
    "docs/21-architecture/runtime-semantics.md",
    "docs/62-schemas-protocols/trace-events.md"
  ],
  "tags": [
    "async",
    "max-inflight",
    "task-ready"
  ]
}
