{
  "schema_version": 1,
  "id": "sensor-fusion-mini",
  "title": "Robot-cell sensor fusion mini scenario",
  "category": "Realistic Scenario",
  "summary": "A small robot-cell-inspired event/data pipeline with time sync, detector stage, async planner, and output boundary.",
  "difficulty": "intermediate",
  "graph": "sensor_fusion_mini.yaml",
  "show_in_readme": false,
  "readme_priority": 90,
  "expected_exit": 0,
  "commands": [
    {
      "label": "Validate",
      "argv": [
        "graph",
        "validate",
        "examples/80-realistic-mini-scenario/sensor_fusion_mini.yaml"
      ],
      "expect_success": true
    },
    {
      "label": "Run",
      "argv": [
        "graph",
        "run",
        "examples/80-realistic-mini-scenario/sensor_fusion_mini.yaml",
        "--steps",
        "3"
      ],
      "expect_success": true
    },
    {
      "label": "Observe",
      "argv": [
        "graph",
        "observe",
        "examples/80-realistic-mini-scenario/sensor_fusion_mini.yaml",
        "--steps",
        "3",
        "--observe-level",
        "summary",
        "--format",
        "ndjson"
      ],
      "expect_success": true
    }
  ],
  "assets": {
    "generate_graph": true,
    "generate_metrics_summary": true,
    "generate_trace_summary": true
  },
  "ci": {
    "validate": true,
    "run": true,
    "render": true,
    "smoke": true
  },
  "related_docs": [
    "docs/11-user-guide/case-study-robot-cell.md",
    "docs/41-development-tools/live-runtime-validation.md"
  ],
  "tags": [
    "realistic",
    "robot-cell",
    "async"
  ]
}
