{
  "schema_version": 1,
  "id": "composite-loop-solver",
  "title": "CompositeLoop iterative solver",
  "category": "Advanced Semantics",
  "summary": "A declared estimator/controller feedback SCC with fixed-point policy, convergence label, and iteration budget.",
  "difficulty": "advanced",
  "graph": "composite_loop_solver.yaml",
  "show_in_readme": true,
  "readme_priority": 50,
  "expected_exit": 0,
  "commands": [
    {
      "label": "Validate",
      "argv": [
        "graph",
        "validate",
        "examples/40-composite-loop/composite_loop_solver.yaml"
      ],
      "expect_success": true
    },
    {
      "label": "Plan",
      "argv": [
        "graph",
        "plan",
        "examples/40-composite-loop/composite_loop_solver.yaml",
        "--format",
        "json"
      ],
      "expect_success": true
    },
    {
      "label": "Render",
      "argv": [
        "graph",
        "render",
        "examples/40-composite-loop/composite_loop_solver.yaml",
        "--format",
        "mermaid"
      ],
      "expect_success": true
    },
    {
      "label": "Run",
      "argv": [
        "graph",
        "run",
        "examples/40-composite-loop/composite_loop_solver.yaml",
        "--steps",
        "2"
      ],
      "expect_success": true
    }
  ],
  "assets": {
    "generate_graph": true,
    "generate_metrics_summary": false,
    "generate_trace_summary": false
  },
  "ci": {
    "validate": true,
    "run": true,
    "render": true,
    "smoke": true
  },
  "related_docs": [
    "docs/21-architecture/runtime-invariants.md",
    "docs/11-user-guide/cookbook.md"
  ],
  "tags": [
    "loop",
    "fixed-point",
    "feedback"
  ]
}
